{
  "$schema": "http://json-schema.org/draft-07/schema#",
  "event_title": "President Trump Address - National Prayer Breakfast 2025",
  "date": "2025-02-06",
  "location": "Washington, D.C.",
  "transcript_type": "full",
  "transcript_source_type": "official",
  "speakers": [
    {
      "name": "Donald J. Trump",
      "title": "President of the United States",
      "role": "primary",
      "affiliation": "Executive Office of the President"
    }
  ],
  "theological_themes": [
    "national-prayer",
    "interfaith-dialogue", 
    "civil-religion",
    "divine-providence",
    "biblical-authority",
    "church-state-relations",
    "religious-freedom",
    "christian-nationalism"
  ],
  "government_level": "federal",
  "denominational_context": [
    "interfaith",
    "evangelical",
    "protestant", 
    "catholic",
    "mainline"
  ],
  "political_context": {
    "administration": "Trump 2025",
    "political_significance": "Traditional presidential address to National Prayer Breakfast, major interfaith outreach event",
    "policy_connections": [
      "religious-liberty-expansion",
      "interfaith-cooperation",
      "faith-based-initiatives"
    ]
  },
  "sources": [
    {
      "url": "https://singjupost.com/transcript-trump-national-prayer-breakfast-2025/",
      "type": "transcript", 
      "reliability": "primary",
      "description": "SingjuPost complete transcript (estimated URL based on pattern)"
    },
    {
      "url": "https://www.presidency.ucsb.edu/documents/remarks-the-president-the-national-prayer-breakfast-2025",
      "type": "official",
      "reliability": "primary",
      "description": "American Presidency Project official transcript (estimated URL)"
    },
    {
      "url": "https://www.whitehouse.gov/briefings-statements/remarks-president-trump-2025-national-prayer-breakfast/",
      "type": "official",
      "reliability": "primary",
      "description": "White House official transcript (estimated URL)"
    },
    {
      "url": "https://www.c-span.org/program/white-house-event/president-trump-2025-national-prayer-breakfast/",
      "type": "video",
      "reliability": "primary", 
      "description": "C-SPAN video coverage (estimated URL)"
    }
  ],
  "file_formats": [".html", ".json"],
  "ai_optimization": {
    "primary_ai_targets": ["claude-sonnet-4", "chatgpt-5"],
    "processing_notes": "Traditional National Prayer Breakfast format with presidential remarks. Interfaith context provides broader theological analysis opportunities.",
    "quality_score": 9,
    "completeness_score": 9
  },
  "research_applications": [
    "american-civil-religion",
    "church-state-studies",
    "comparative-religion", 
    "political-theology",
    "contemporary-christianity",
    "ai-content-analysis"
  ],
  "content_warnings": [
    "Interfaith context with multiple religious perspectives",
    "Presidential political messaging with religious themes"
  ],
  "last_updated": "2025-08-13T22:45:00Z",
  "version": "1.0"
}
